{
  "id": "1700000000-workflow-default-methodology",
  "name": "GitGovernance Default Methodology",
  "description": "Standard GitGovernance workflow with quality gates and agent collaboration",
  "state_transitions": {
    "submit": {
      "from": [
        "draft"
      ],
      "to": "review",
      "requires": {
        "command": "gitgov task submit",
        "signatures": {
          "__default__": {
            "role": "submitter",
            "capability_roles": [
              "author"
            ],
            "min_approvals": 1
          }
        }
      }
    },
    "approve": {
      "from": [
        "review"
      ],
      "to": "ready",
      "requires": {
        "command": "gitgov task approve",
        "signatures": {
          "__default__": {
            "role": "approver",
            "capability_roles": [
              "approver:product"
            ],
            "min_approvals": 1
          },
          "design": {
            "role": "approver",
            "capability_roles": [
              "approver:design"
            ],
            "min_approvals": 1
          },
          "quality": {
            "role": "approver",
            "capability_roles": [
              "approver:quality"
            ],
            "min_approvals": 1
          }
        }
      }
    },
    "activate": {
      "from": [
        "ready",
        "paused"
      ],
      "to": "active",
      "requires": {
        "event": "first_execution_record_created",
        "custom_rules": [
          "task_must_have_valid_assignment_for_executor"
        ]
      }
    },
    "complete": {
      "from": [
        "active"
      ],
      "to": "done",
      "requires": {
        "command": "gitgov task complete",
        "signatures": {
          "__default__": {
            "role": "approver",
            "capability_roles": [
              "approver:quality"
            ],
            "min_approvals": 1
          }
        }
      }
    },
    "archive": {
      "from": [
        "done"
      ],
      "to": "archived",
      "requires": {
        "command": "gitgov task archive"
      }
    },
    "pause": {
      "from": [
        "active",
        "review"
      ],
      "to": "paused",
      "requires": {
        "event": "feedback_blocking_created"
      }
    },
    "cancel": {
      "from": [
        "ready",
        "active"
      ],
      "to": "discarded",
      "requires": {
        "command": "gitgov task cancel",
        "signatures": {
          "__default__": {
            "role": "canceller",
            "capability_roles": [
              "approver:product",
              "approver:quality"
            ],
            "min_approvals": 1
          }
        }
      }
    }
  },
  "custom_rules": {
    "task_must_have_valid_assignment_for_executor": {
      "description": "Task must have a valid assignment before execution can begin",
      "validation": "assignment_required"
    },
    "task_must_be_in_active_sprint": {
      "description": "Task must belong to an active sprint cycle",
      "validation": "sprint_capacity"
    },
    "epic_promotion_required": {
      "description": "Complex tasks must be promoted to epic with child cycles",
      "validation": "epic_complexity"
    }
  }
}
